{
  "schemaVersion": 1,
  "clientId": "safari-tours-sharm",
  "product": {
    "id": "wego-tours-operator",
    "version": "0.1.0"
  },
  "deploymentIsolation": "ISOLATED_INSTANCE",
  "modules": [
    "platform.events",
    "platform.identity",
    "platform.security",
    "platform.transaction",
    "product.tours-operator"
  ],
  "artifacts": {
    "backend": {
      "gradleProject": ":platform:apps:safari-tours-sharm",
      "projectPath": "platform/apps/safari-tours-sharm",
      "dockerfile": "infrastructure/docker/safari-backend.Dockerfile",
      "jar": "platform/apps/safari-tours-sharm/build/libs/safari-tours-sharm-0.1.0-SNAPSHOT.jar",
      "includedModules": [
        "platform.events",
        "platform.identity",
        "platform.security",
        "platform.transaction",
        "product.tours-operator"
      ],
      "migrationVersions": [
        "1",
        "2",
        "3",
        "14",
        "16",
        "17",
        "18",
        "19",
        "20",
        "21",
        "22",
        "23",
        "24",
        "25",
        "26",
        "27",
        "28",
        "29",
        "30",
        "31",
        "32",
        "33",
        "34",
        "35",
        "36",
        "37"
      ],
      "migrationFiles": [
        "platform/application/src/main/resources/db/migration/V1__platform_foundation.sql",
        "platform/application/src/main/resources/db/migration/V2__identity_foundation.sql",
        "platform/apps/safari-tours-sharm/src/main/resources/db/migration/V3__identity_administration.sql",
        "platform/application/src/main/resources/db/migration/V14__tours_operator_foundation.sql",
        "platform/application/src/main/resources/db/migration/V16__tours_operator_catalog_content.sql",
        "platform/application/src/main/resources/db/migration/data/V17__tours_operator_catalog_seed.sql",
        "platform/application/src/main/resources/db/migration/V18__tours_operator_payment.sql",
        "platform/application/src/main/resources/db/migration/V19__tours_operator_payment_hardening.sql",
        "platform/application/src/main/resources/db/migration/V20__tours_operator_payment_revenue_recognition.sql",
        "platform/application/src/main/resources/db/migration/V21__tours_operator_payment_audit.sql",
        "platform/application/src/main/resources/db/migration/V22__tours_operator_notification.sql",
        "platform/application/src/main/resources/db/migration/V23__tours_operator_tour_content.sql",
        "platform/application/src/main/resources/db/migration/V24__tours_operator_unit_pricing.sql",
        "platform/application/src/main/resources/db/migration/data/V25__tours_operator_catalog_revision_and_seats.sql",
        "platform/application/src/main/resources/db/migration/V26__tours_operator_sales_control.sql",
        "platform/application/src/main/resources/db/migration/V27__tours_operator_captured_payment_review.sql",
        "platform/application/src/main/resources/db/migration/V28__tours_operator_payment_refund_callback.sql",
        "platform/application/src/main/resources/db/migration/V29__tours_operator_asset_registry.sql",
        "platform/application/src/main/resources/db/migration/V30__tours_operator_office_booking.sql",
        "platform/application/src/main/resources/db/migration/V31__tours_operator_office_documents.sql",
        "platform/application/src/main/resources/db/migration/V32__tours_operator_ops_registry.sql",
        "platform/application/src/main/resources/db/migration/V33__tours_operator_costs_settlements.sql",
        "platform/application/src/main/resources/db/migration/V34__tours_operator_online_requests.sql",
        "platform/application/src/main/resources/db/migration/V35__tours_operator_request_confirmation_email.sql",
        "platform/application/src/main/resources/db/migration/data/V36__tours_operator_owner_catalog_corrections.sql",
        "platform/application/src/main/resources/db/migration/data/V37__tours_operator_owner_catalog_revision_part2.sql"
      ]
    },
    "publicSite": {
      "packageName": "@wego/safari-tours-sharm-site",
      "path": "web/apps/safari-tours-sharm-site",
      "dockerfile": "infrastructure/docker/safari-site.Dockerfile"
    },
    "staffApp": {
      "packageName": "@wego/safari-tours-sharm-erp",
      "path": "web/apps/safari-tours-sharm-erp",
      "dockerfile": "infrastructure/docker/safari-erp.Dockerfile"
    },
    "apiContract": {
      "path": "platform/contracts/openapi/v1/wego-api.yaml",
      "ownedPathPrefixes": [
        "/api/v1/identity/",
        "/api/v1/tours-operator/"
      ]
    },
    "compose": {
      "path": "infrastructure/compose/safari-tours-sharm.compose.yaml",
      "environmentExample": ".env.safari-tours-sharm.example",
      "services": [
        "postgres",
        "backend",
        "safari-site",
        "web",
        "edge"
      ]
    }
  },
  "dataIsolation": {
    "schema": "wego",
    "allowedTablePrefixes": [
      "identity_",
      "integration_",
      "tours_operator_"
    ],
    "allowedPermissionPrefixes": [
      "identity:",
      "tours-operator."
    ]
  },
  "digests": {
    "releaseLock": "0cec7fbf3c8a77120601a45f54a6b678f233a54190e37627f2524e7286e4255a",
    "releaseProfiles": "a657c9541344e79f68ec733cf8cd03d94f53706bd7ee7e1abc7533f515ae129e"
  }
}
